{
  "project_name": "demo_game",
  "input_validation_status": "partial",
  "repairs_attempted": [
    {
      "issue": "batch_missing_files",
      "action": "apply_minimal_safe_repairs",
      "files_changed": [
        "/Users/ishanharshaddiwekar/AI3/artifacts/_tmp_js_tests/out_runner_repair/target/demo_game/scenes/gameplay.tscn",
        "/Users/ishanharshaddiwekar/AI3/artifacts/_tmp_js_tests/out_runner_repair/target/demo_game/scripts/gameplay/gameplay_controller.gd"
      ],
      "notes": ""
    }
  ],
  "result_status": "resolved",
  "remaining_issues": [],
  "next_recommended_action": "Project validation passed after repairs.",
  "generated_at": "2026-03-25T07:49:45.570Z"
}