{
  "project_name": "MyProject1",
  "input_validation_status": "partial",
  "repairs_attempted": [],
  "result_status": "failed",
  "remaining_issues": [
    "acceptance_check_skipped",
    "acceptance_check_skipped",
    "acceptance_check_skipped",
    "acceptance_check_skipped"
  ],
  "next_recommended_action": "Remaining issues are not safely auto-repairable; manual intervention needed.",
  "generated_at": "2026-03-25T14:50:57.279Z"
}